{
  "manifest_version": 2,
  "source": "full",
  "regions": [],
  "platform": "misterfpga",
  "display_name": "MiSTer FPGA",
  "version": "1.0",
  "generated": "2026-10-04T15:54:42Z",
  "base_destination": "games",
  "detect": [
    {
      "os": "linux",
      "method": "path_exists",
      "path": "/media/fat/MiSTer",
      "bios_path": "/media/fat/games"
    }
  ],
  "standalone_copies": [],
  "total_files": 77,
  "total_size": 25769161,
  "pack_files": 79,
  "pack_size": 25769161,
  "total_omitted": 4,
  "omitted_files": [
    {
      "dest": "Marty/mrom.m36",
      "name": "mrom.m36",
      "system": "marty",
      "required": true,
      "reason": "not_found",
      "cores": null
    },
    {
      "dest": "Marty/mrom.m37",
      "name": "mrom.m37",
      "system": "marty",
      "required": true,
      "reason": "not_found",
      "cores": null
    },
    {
      "dest": "Studio-II/openstudio2.bin",
      "name": "openstudio2.bin",
      "system": "studio-ii",
      "required": true,
      "reason": "not_found",
      "cores": null
    },
    {
      "dest": "VideoBrain/boot.rom",
      "name": "boot.rom",
      "system": "videobrain",
      "required": true,
      "reason": "hash_mismatch",
      "cores": null
    }
  ],
  "files": [
    {
      "dest": "3DO/boot.rom",
      "sha1": "34bf189111295f74d7b7dfc1f304d98b8d36325a",
      "sha256": "41b5b8e7c44e55eaf5cfd4f2a58df42f4a1bbc776723368fb25bf118dd631b1b",
      "size": 1048576,
      "repo_path": "bios/3DO Company/3DO/panafz1.bin",
      "cores": null
    },
    {
      "dest": "3DO/kanji.rom",
      "sha1": "884515605ee243577ab20767ef8c1a7368e4e407",
      "sha256": "8974193e76cf255ebc40fe20b95b405db2cc1ea07910584380e50c6d9ca181aa",
      "size": 1048576,
      "repo_path": "bios/3DO Company/3DO/panafz1j-kanji.bin",
      "cores": null
    },
    {
      "dest": "Apple-IIgs/boot.rom",
      "sha1": "bc32bc0e8902946663998f56aea52be597d9e361",
      "sha256": "01398a51b3aa16c40bb3d5df43494316cc12eebb87871712cecc396e1beb2df8",
      "size": 262144,
      "repo_path": "bios/Apple/Apple II/apple2gs.rom",
      "cores": null
    },
    {
      "dest": "Apple-IIgs/boot1.rom",
      "sha1": "e4fc7560b69d062cb2da5b1ffbe11cd1ca03cc37",
      "sha256": "34cd454c6201bfd26839d6ace2ff6b1231e09d6279e49b4890311756dc3825fb",
      "size": 131072,
      "repo_path": "bios/Apple/Apple IIGS/ROM",
      "cores": null
    },
    {
      "dest": "Jaguar/boot.rom",
      "sha1": "af643900fea84234e08b616a6d27f03f0a61db96",
      "sha256": "f0bd29599b3dfca7f5620c011256c1dc45c9d82c428a318f965c2ba3ded2e9f9",
      "size": 131072,
      "repo_path": "bios/Atari/Jaguar/boot.rom",
      "cores": null
    },
    {
      "dest": "Jaguar/boot1.rom",
      "sha1": "73f7356daec9edf7ce2dc35432b1ed948cacbe84",
      "sha256": "7ebadb56f8082c86d6f74e2c38e02b218db420d3049f8f9c988f6490dc7f9fc0",
      "size": 262144,
      "repo_path": "bios/Atari/Jaguar/boot1.rom",
      "cores": null
    },
    {
      "dest": "Jaguar/boot2.rom",
      "sha1": "6bb291d62fc69e2f9b26c6ead86d3e0022eab3ce",
      "sha256": "bf02591cfe4ab4f082ea23c447da5c53afbfddace6d700b785ba04b7ac5c64e0",
      "size": 131072,
      "repo_path": "bios/Atari/Jaguar/boot2.rom",
      "cores": null
    },
    {
      "dest": "AtariLynx/boot.rom",
      "sha1": "e4ed47fae31693e016b081c6bda48da5b70d7ccb",
      "sha256": "c26a36c1990bcf841155e5a6fea4d2ee1a4d53b3cc772e70f257a962ad43b383",
      "size": 512,
      "repo_path": "bios/Atari/Lynx/Atari_LYNX_boot.img",
      "cores": null
    },
    {
      "dest": "Astrocade/boot.rom",
      "sha1": "b902c941997c9d150a560435bf517c6a28137ecc",
      "sha256": "f01220d94b82145a6d18f114ff59be9c178f69de24f8ad0f4d19eee8b86b17c7",
      "size": 8192,
      "repo_path": "bios/Bally/Astrocade/astro.bin",
      "cores": null
    },
    {
      "dest": "Casio_PV-2000/boot0.rom",
      "sha1": "94b5f54dd7bce321e377fdaaf592acd3870cf621",
      "sha256": "2587d206eb63917848ea30e14232448ed4f873c6796a22e2bf6543b01f46308e",
      "size": 16384,
      "repo_path": "bios/Casio/PV-2000/hn613128pc64.bin",
      "cores": null
    },
    {
      "dest": "CreatiVision/boot.rom",
      "sha1": "c12e098c14ac0724869053df2b63277a3e413802",
      "sha256": "48a7fda99c1b9c0d90b70de0b4a9431a5a781f94d1874ee6d91830a638c9e5c3",
      "size": 16384,
      "repo_path": "bios/VTech/CreatiVision/laser2001.rom",
      "cores": null
    },
    {
      "dest": "SCV/boot.rom",
      "sha1": "e5808cb1f96b39a0d52d67de79a626072f80ef12",
      "sha256": "25c7ff2d735d1ae895af9262f31e083c5c1bd99a8f31b5b378dfbc0f166ec97f",
      "size": 6144,
      "repo_path": "bios/Epoch/Super Cassette Vision/boot.rom",
      "cores": null
    },
    {
      "dest": "Gamate/boot.rom",
      "sha1": "ea449dc607601f9a68d855ad6ab53800d2e99297",
      "sha256": "26f206fa4eedbe040f619e3af78efa1d38588535b1d746f6a462da639ced4b1e",
      "size": 4096,
      "repo_path": "bios/Bit Corporation/Gamate/gamate_bios_umc.bin",
      "cores": null
    },
    {
      "dest": "GameKing/boot.rom",
      "sha1": "e0d056f8ebfdf52ef6796d0375eba7fcc4a6a9d3",
      "sha256": "7843fd082889cac046d446160f38755f7c8c4a8e4f9dd9d5104b185f0bc1dec4",
      "size": 524288,
      "repo_path": "bios/TimeTop/GameKing/boot.rom",
      "cores": null
    },
    {
      "dest": "Interact/boot.rom",
      "sha1": "405806c97378abcf7c7b0d549430c78c7fc60ba2",
      "sha256": "e0888ba82382aabb7557aa4a3445e613bd7f33bae1af5ece211e2cb6bc9ffa82",
      "size": 2048,
      "repo_path": "bios/Interact/Home Computer/interact.rom",
      "cores": null
    },
    {
      "dest": "Loopy/boot0.rom",
      "sha1": "17542ef275ea8ebeaaddd00d304232c3c355ea25",
      "sha256": "82a8d6add06e324e36c71b0a7a92d607af3db5e65574a6892794d70df668e9d5",
      "size": 32768,
      "repo_path": "bios/Casio/Loopy/boot0.rom",
      "cores": null
    },
    {
      "dest": "Loopy/boot1.rom",
      "sha1": "99f50be06b083fdb07e08f30b0b26d9037afc869",
      "sha256": "7540ff64268e500a34fb83c8642510d341440ac6258f6c36851e182870e40f75",
      "size": 524288,
      "repo_path": "bios/Casio/Loopy/boot1.rom",
      "cores": null
    },
    {
      "dest": "Intellivision/boot0.rom",
      "sha1": "5a65b922b562cb1f57dab51b73151283f0e20c7a",
      "sha256": "1aeb614856beba95463166daf09304b414d5617d3f37d221724b3337fc4b2722",
      "size": 8192,
      "repo_path": "bios/Mattel/Intellivision/INTV_EROM.bin",
      "cores": null
    },
    {
      "dest": "Intellivision/boot1.rom",
      "sha1": "f9608bb4ad1cfe3640d02844c7ad8e0bcd974917",
      "sha256": "a80b6841182547d08635ad30a6af71441c4c9eed9391b3dd22feb30d8e50cc85",
      "size": 2048,
      "repo_path": "bios/Mattel/Intellivision/INTV_GROM.bin",
      "cores": null
    },
    {
      "dest": "Intellivision/boot2.rom",
      "sha1": "618563e512ff5665183664f52270fa9606c9d289",
      "sha256": "dabade432af1523f43029057071ca8c1ed3604498c784603e8733023382ad7a5",
      "size": 2048,
      "repo_path": "bios/Mattel/Intellivision/IVOICE.BIN",
      "cores": null
    },
    {
      "dest": "Intellivision/boot3.rom",
      "sha1": "b7ccb38b881d7f8426cd6f1f8a7aabbd31784fc5",
      "sha256": "2fcea60039c4a8836b9bb71e391d70a145c724b4dae516be733fe842ba6687c7",
      "size": 24576,
      "repo_path": "bios/Mattel/Intellivision/ECS.bin",
      "cores": null
    },
    {
      "dest": "MSX1/boot.rom",
      "sha1": "829c00c3114f25b3dae5157c0a238b52a3ac37db",
      "sha256": "04fd77f02f652770cbb3cc6b4a594cc736d56486a106c1068965f1fe090746a5",
      "size": 32768,
      "repo_path": "bios/Microsoft/MSX/share/systemroms/vg8020_basic-bios1.rom",
      "cores": null
    },
    {
      "dest": "PC8801/boot.rom",
      "sha1": "7a6676e352c8d0eaf16e5863c1c98ac65d6f8686",
      "sha256": "0dc3fcf58c90c1f119a710babd54b57babf81ba8573c070b33f0cc21948b3086",
      "size": 393216,
      "repo_path": "bios/NEC/PC-88/PC8801 MKII SR BIOS.rom",
      "cores": null
    },
    {
      "dest": "TGFX16-CD/cd_bios.rom",
      "sha1": "7b3fa6c265d56687d6bff09da5d34caa92e8d2ce",
      "sha256": "b057e09822c3767120ba56f2ce02f089b5824d4b489ea3cd7ad9405b3a339a52",
      "size": 262144,
      "repo_path": "bios/NEC/PC Engine CD/Super CD 3.1.pce",
      "cores": null
    },
    {
      "dest": "NGPC/boot0.rom",
      "sha1": "edc13192054a59be49c6d55f83b70e2510968e86",
      "sha256": "8fb845a2f71514cec20728e2f0fecfade69444f8d50898b92c2259f1ba63e10d",
      "size": 65536,
      "repo_path": "bios/SNK/Neo Geo Pocket/SNK Neo-Geo Pocket Color BIOS (1999)(SNK)(en-ja).bin",
      "cores": null
    },
    {
      "dest": "NGPC/boot1.rom",
      "sha1": "2f6429b68446536d8b03f35d02f1e98beb6460a0",
      "sha256": "0293555b21c4fac516d25199df7809b26beeae150e1d4504a050db32264a6ad7",
      "size": 65536,
      "repo_path": "bios/SNK/Neo Geo Pocket/SNK Neo-Geo Pocket BIOS (1998)(SNK)(en-ja).bin",
      "cores": null
    },
    {
      "dest": "N64/boot.rom",
      "sha1": "b7a0070cbe4b9bcaa08ec0b76b8c4955b2ae535a",
      "sha256": "fa7b09795ef1e54461e59f6f2d902368133e3f1cd980e34383e6a780d74beffd",
      "size": 1984,
      "repo_path": "bios/Nintendo/Nintendo 64/boot.rom",
      "cores": null
    },
    {
      "dest": "N64/boot1.rom",
      "sha1": "15c23c3b671a8828302603f30c81d464b24a7fb1",
      "sha256": "79c81fffae934b6df251da6c3a394f52c6a0eaa07115a3b9677743e3c1335f4a",
      "size": 1984,
      "repo_path": "bios/Nintendo/Nintendo 64/boot1.rom",
      "cores": null
    },
    {
      "dest": "N64/boot3.rom",
      "sha1": "bf861922dcb78c316360e3e742f4f70ff63c9bc3",
      "sha256": "806400ec0df94b0755de6c5b8249d6b6a9866124c5ddbdac198bde22499bfb8b",
      "size": 4194304,
      "repo_path": "bios/Nintendo/64DD/64DD_IPL_v12_JPN.bin",
      "cores": null
    },
    {
      "dest": "N64/boot4.rom",
      "sha1": "10c4173c2a7eb09c6579818f72ef18fa0b6d32de",
      "sha256": "9c2962a8b994a29e4cd04b3a6e4ed730a751414655ab6a9799ebf5fc08b79d44",
      "size": 4194304,
      "repo_path": "bios/Nintendo/64DD/64DD_IPL_DEV.bin",
      "cores": null